Col 1,Col 2
Adhesive manufacturing,GiS-1
All other basic organic chemical manufacturing,GiS-2
All other miscellaneous chemical product and preparation manufacturing,GiS-3
Ammunition (except small arms) manufacturing,GiS-4
Artificial and synthetic fibers and filaments manufacturing,GiS-5
Cement manufacturing,GiS-6
"Copper rolling, drawing, extruding, and alloying",GiS-7
Ethyl alcohol manufacturing,GiS-8
Guided missile and space vehicle propulsion unit and propulsion unit parts manufacturing,GiS-9
Hazardous waste treatment and disposal,GiS-10
In-vitro diagnostic substance manufacturing,GiS-11
Industrial gas manufacturing,GiS-12
Irradiation apparatus manufacturing,GiS-13
Materials recovery facilities,GiS-14
Medicinal and botanical manufacturing,GiS-15
"Metal coating, engraving (except jewelry and silverware), and allied services to manufacturers ",GiS-16
"Metal crown, closure, and other metal stamping (except automotive) ",GiS-17
National security,GiS-18
Other basic inorganic chemical manufacturing,GiS-19
Other chemical and allied products merchant wholesalers,GiS-20
Paint and coating manufacturing,GiS-21
Pesticide and other agricultural chemical manufacturing,GiS-22
Petrochemical manufacturing,GiS-23
Petroleum lubricating oil and grease manufacturing,GiS-24
Pharmaceutical preparation manufacturing,GiS-25
Photographic and photocopying equipment manufacturing,GiS-26
Plastics material and resin manufacturing,GiS-27
Precision turned product manufacturing,GiS-28
"Special die and tool, die set, jig, and fixture manufacturing ",GiS-29
Sporting and athletic goods manufacturing,GiS-30
Surgical and medical instrument manufacturing,GiS-31
