Col 1,Col 2
All other miscellaneous chemical product and preparation manufacturing,RETDFiS-1
Hazardous waste treatment and disposal,RETDFiS-2
Cement manufacturing,RETDFiS-3
Materials recovery facilities,RETDFiS-4
Solid waste combustors and incinerators,RETDFiS-5
Petroleum lubricating oil and grease manufacturing,RETDFiS-6
All other basic organic chemical manufacturing,RETDFiS-7
"Photographic film, paper, plate, and chemical manufacturing ",RETDFiS-8
Pesticide and other agricultural chemical manufacturing,RETDFiS-9
